{
  "contract": {
    "id": "CT-QLT-001",
    "version": "1.0.0"
  },
  "report_id": "QRP-2026-000001",
  "request_id": "REQ-2026-000001",
  "draft_id": "DRF-2026-000001",
  "draft_version": "1.0.0",
  "framework_version": "1.0.0",
  "gate_results": [
    {
      "gate": "final_publication_gate",
      "result": "pass"
    }
  ],
  "dimension_scores": {
    "factuality": 4.5
  },
  "issues": [],
  "unable_to_verify": [],
  "auto_fixes": [],
  "remaining_risks": [],
  "publish_recommendation": "publish_ready",
  "evaluated_at": "2026-07-16T20:40:00+09:00"
}